{
  "tabId": "500123",
  "tabLabel": "example_value",
  "documentId": "500123",
  "pageNumber": "example_value",
  "recipientId": "500123",
  "xPosition": "example_value",
  "yPosition": "example_value",
  "anchorString": "example_value",
  "value": "example_value",
  "listItems": [],
  "required": "example_value"
}